title,company,location,url,posted_date,provider,description,role_category,level
"AI/ML Engineering Manager, Payment Intelligence",stripe,"US-SF, US-NYC, US-SEA",https://stripe.com/jobs/search?gh_jid=7286376,2025-10-07T17:16:41-04:00,greenhouse,,Software Engineering,Entry Level
"Android Engineer, OS Platform",stripe,"San Francisco, Remote in US, Remote in Canada",https://stripe.com/jobs/search?gh_jid=7243475,2025-10-15T15:30:57-04:00,greenhouse,,Software Engineering,Entry Level
"Android Engineer, Terminal Commerce Experience",stripe,"Toronto, Remote in Canada",https://stripe.com/jobs/search?gh_jid=7243948,2025-10-15T15:30:57-04:00,greenhouse,,Software Engineering,Entry Level
"Backend/API Engineer, Money as a Service (US)",stripe,US,https://stripe.com/jobs/search?gh_jid=6176758,2025-10-01T12:41:59-04:00,greenhouse,,Software Engineering,Entry Level
"Backend Engineer/API, Payments and Risk",stripe,"Toronto, Canada Remote",https://stripe.com/jobs/search?gh_jid=6692166,2025-10-07T12:43:10-04:00,greenhouse,,Software Engineering,Entry Level
"Backend Engineer/API, Payments and Risk (US)",stripe,US,https://stripe.com/jobs/search?gh_jid=6163230,2025-10-01T12:41:59-04:00,greenhouse,,Software Engineering,Entry Level
"Backend Engineer, Core Tech, Canada",stripe,"Toronto, CAN-Remote",https://stripe.com/jobs/search?gh_jid=6567253,2025-10-01T12:41:59-04:00,greenhouse,,Software Engineering,Entry Level
"Backend Engineer, Revenue and Financial Automation",stripe,"Toronto, CAN-Remote",https://stripe.com/jobs/search?gh_jid=7217048,2025-10-15T15:30:54-04:00,greenhouse,,Software Engineering,Entry Level
Broadcast Engineer,stripe,"San Francisco, Seattle",https://stripe.com/jobs/search?gh_jid=7281231,2025-10-15T15:31:01-04:00,greenhouse,,Software Engineering,Entry Level
Broadcast Engineer,stripe,"San Francisco, CA ",https://stripe.com/jobs/search?gh_jid=6632309,2025-10-15T15:29:54-04:00,greenhouse,,Software Engineering,Entry Level
Business Partner Analyst,stripe,"US, Chicago Only",https://stripe.com/jobs/search?gh_jid=5986232,2025-10-14T12:28:45-04:00,greenhouse,,Software Engineering,Entry Level
"Compensation Partner, Product & Engineering",stripe,"NYC, San Francisco, Seattle",https://stripe.com/jobs/search?gh_jid=7203552,2025-10-15T15:30:52-04:00,greenhouse,,Software Engineering,Entry Level
"Corporate Engineering Manager, Automations & Integrations",stripe,Remote in the US,https://stripe.com/jobs/search?gh_jid=7155895,2025-10-15T15:30:48-04:00,greenhouse,,Software Engineering,Entry Level
"Credit Risk Strategy Analyst, Portfolio and Policy Management",stripe,"Toronto, Remote in Canada",https://stripe.com/jobs/search?gh_jid=7095463,2025-10-01T12:41:59-04:00,greenhouse,,Software Engineering,Entry Level
Data Analyst,stripe,US,https://stripe.com/jobs/search?gh_jid=5601881,2025-10-15T17:26:10-04:00,greenhouse,,Software Engineering,Entry Level
"Data Analyst, Communications & Policy",stripe,US-Remote,https://stripe.com/jobs/search?gh_jid=7292227,2025-10-15T15:31:03-04:00,greenhouse,,Software Engineering,Entry Level
"Data Analyst, GTM Analytics",stripe,"Toronto, US-Remote",https://stripe.com/jobs/search?gh_jid=7264869,2025-10-15T15:31:00-04:00,greenhouse,,Software Engineering,Entry Level
"Design Engineer, Presence",stripe,"US Remote, Canada",https://stripe.com/jobs/search?gh_jid=7144975,2025-10-15T15:30:48-04:00,greenhouse,,Software Engineering,Entry Level
"Developer Experience Engineer, Privy",stripe,"NYC-Privy, US-Remote",https://stripe.com/jobs/search?gh_jid=7104344,2025-10-01T12:41:59-04:00,greenhouse,,Software Engineering,Entry Level
"Engineering Manager, Privy ",stripe,New York Privy HQ,https://stripe.com/jobs/search?gh_jid=7129418,2025-10-06T14:36:32-04:00,greenhouse,,Software Engineering,Entry Level
"Engineering Manager, Product and Business",stripe,"US-Remote, Chicago, Seattle, San Francisco",https://stripe.com/jobs/search?gh_jid=6909015,2025-10-01T12:41:59-04:00,greenhouse,,Software Engineering,Entry Level
Finance & Strategy Analyst,stripe,"South San Francisco, Seattle, New York",https://stripe.com/jobs/search?gh_jid=5890119,2025-10-01T12:41:59-04:00,greenhouse,,Software Engineering,Entry Level
"Forward Deployed Engineer, Privy",stripe,New York Privy HQ,https://stripe.com/jobs/search?gh_jid=7230452,2025-10-15T15:30:55-04:00,greenhouse,,Software Engineering,Entry Level
"Frontend Engineering Manager, Payments",stripe,"Seattle, San Francisco",https://stripe.com/jobs/search?gh_jid=7063232,2025-10-01T12:41:59-04:00,greenhouse,,Software Engineering,Entry Level
"Full Stack Engineer, Managed Operations",stripe,"Seattle, New York City ",https://stripe.com/jobs/search?gh_jid=7271571,2025-10-13T20:53:19-04:00,greenhouse,,Software Engineering,Entry Level
"Integration Engineer, Stablecoin",stripe,United States,https://stripe.com/jobs/search?gh_jid=7155907,2025-10-15T15:30:48-04:00,greenhouse,,Software Engineering,Entry Level
"Integration Reliability Engineer, Technical Operations, Local Payment Methods",stripe,"Toronto, Remote in Canada",https://stripe.com/jobs/search?gh_jid=7286378,2025-10-07T15:17:13-04:00,greenhouse,,Software Engineering,Entry Level
"Machine Learning Engineer, Foundation Model",stripe,US - San Francisco; Seattle; New York City,https://stripe.com/jobs/search?gh_jid=7275014,2025-10-07T15:15:31-04:00,greenhouse,,Software Engineering,Entry Level
"Machine Learning Engineer, Identity Product",stripe,"San Francisco, Seattle",https://stripe.com/jobs/search?gh_jid=6363655,2025-10-01T12:41:59-04:00,greenhouse,,Software Engineering,Entry Level
"Machine Learning Engineer, Payments ML Accelerator",stripe,Seattle; San Francisco; New York City,https://stripe.com/jobs/search?gh_jid=7079044,2025-10-01T12:41:59-04:00,greenhouse,,Software Engineering,Entry Level
"Machine Learning Engineer, Supportability",stripe,San Francisco or Seattle,https://stripe.com/jobs/search?gh_jid=7176812,2025-10-15T15:30:50-04:00,greenhouse,,Software Engineering,Entry Level
 Monetization Services Analyst,stripe,US-SEA,https://stripe.com/jobs/search?gh_jid=7246905,2025-10-15T15:30:58-04:00,greenhouse,,Software Engineering,Entry Level
"PhD Machine Learning Engineer, Intern",stripe,"San Francisco, New York City, Seattle",https://stripe.com/jobs/search?gh_jid=7216664,2025-10-01T16:37:43-04:00,greenhouse,,Software Engineering,Entry Level
"PhD Machine Learning Engineer, New Grad",stripe,"San Francisco, New York City, Seattle",https://stripe.com/jobs/search?gh_jid=7216668,2025-10-01T16:37:45-04:00,greenhouse,,Software Engineering,New Grad
"Principal ML Engineer, ML Foundations",stripe,"US-SF, US-NYC, US-SEA",https://stripe.com/jobs/search?gh_jid=7278350,2025-10-03T08:28:47-04:00,greenhouse,,Software Engineering,Entry Level
"Regulatory Affairs Licensing Specialist, NORAM",stripe,"US-SF, US-NYC, US-Remote",https://stripe.com/jobs/search?gh_jid=7254474,2025-10-15T15:30:59-04:00,greenhouse,,Software Engineering,Entry Level
Risk Operations Analyst,stripe,"Remote, United States ",https://stripe.com/jobs/search?gh_jid=5950076,2025-10-15T15:29:06-04:00,greenhouse,,Software Engineering,Entry Level
"Salesforce Engineer, Seller Systems",stripe,"US, Canada",https://stripe.com/jobs/search?gh_jid=7201375,2025-10-15T15:30:52-04:00,greenhouse,,Software Engineering,Entry Level
"Sales Strategy & Operations Analyst, Billing",stripe,"Chi, ATL, US-Remote",https://stripe.com/jobs/search?gh_jid=7308388,2025-10-09T09:23:45-04:00,greenhouse,,Software Engineering,Entry Level
 Security Investigations Analyst,stripe,"Remote, North America",https://stripe.com/jobs/search?gh_jid=7137787,2025-10-01T12:41:59-04:00,greenhouse,,Cybersecurity,Entry Level
"Senior Staff Engineer, Core Infrastructure",stripe,"Seattle, US Remote",https://stripe.com/jobs/search?gh_jid=7017350,2025-10-01T12:41:59-04:00,greenhouse,,Software Engineering,Entry Level
Senior Staff Engineer- Service Infrastructure ,stripe,"Seattle, San Francisco",https://stripe.com/jobs/search?gh_jid=7066778,2025-10-01T12:41:59-04:00,greenhouse,,Software Engineering,Entry Level
"Software Engineer, Intern (Summer and Winter)",stripe,"San Francisco, Seattle, New York City",https://stripe.com/jobs/search?gh_jid=7210115,2025-10-01T12:41:59-04:00,greenhouse,,Software Engineering,Entry Level
"Software Engineer, Link",stripe,USA,https://stripe.com/jobs/search?gh_jid=7316296,2025-10-15T15:31:07-04:00,greenhouse,,Software Engineering,Entry Level
"Software Engineer, New Grad",stripe,"San Francisco, Seattle",https://stripe.com/jobs/search?gh_jid=7210112,2025-10-01T12:41:59-04:00,greenhouse,,Software Engineering,New Grad
"Specialist Solutions Architect, Crypto & Stablecoins",stripe,US-SF,https://stripe.com/jobs/search?gh_jid=7120766,2025-10-01T12:41:59-04:00,greenhouse,,Software Engineering,Entry Level
"Staff Engineer, App Platform",stripe,"San Francisco, Seattle",https://stripe.com/jobs/search?gh_jid=6885408,2025-10-09T12:39:22-04:00,greenhouse,,Software Engineering,Entry Level
"Staff Engineer, Experimental Projects",stripe,US-Remote,https://stripe.com/jobs/search?gh_jid=7280343,2025-10-03T08:40:33-04:00,greenhouse,,Software Engineering,Entry Level
"Staff Engineer, IAM Control Plane",stripe,Us Remote,https://stripe.com/jobs/search?gh_jid=7309416,2025-10-10T17:13:59-04:00,greenhouse,,Software Engineering,Entry Level
"Staff Engineer, RFA Forward Deployed Engineering",stripe,Seattle,https://stripe.com/jobs/search?gh_jid=7154047,2025-10-01T12:41:59-04:00,greenhouse,,Software Engineering,Entry Level
"Staff Engineer, Usage Based Billing ",stripe,US Locations,https://stripe.com/jobs/search?gh_jid=7124531,2025-10-15T15:30:44-04:00,greenhouse,,Software Engineering,Entry Level
"Staff Frontend Engineer, Privy",stripe,"NYC-Privy, US-Remote ",https://stripe.com/jobs/search?gh_jid=7091959,2025-10-01T12:41:59-04:00,greenhouse,,Software Engineering,Entry Level
"Staff Product Designer, Developer AI",stripe,US / Canada,https://stripe.com/jobs/search?gh_jid=7164051,2025-10-01T12:41:59-04:00,greenhouse,,Software Engineering,Entry Level
"Staff Security Engineer, Privy",stripe,"NYC-Privy, US-Remote",https://stripe.com/jobs/search?gh_jid=7104148,2025-10-01T12:41:59-04:00,greenhouse,,Cybersecurity,Entry Level
"Staff Security Engineer, Security Partnerships",stripe,"Remote, North America",https://stripe.com/jobs/search?gh_jid=6892149,2025-10-13T02:53:10-04:00,greenhouse,,Cybersecurity,Entry Level
"Staff Software Engineer, Data",stripe,"Toronto, Canada, Canada Remote ",https://stripe.com/jobs/search?gh_jid=6482105,2025-10-15T13:05:54-04:00,greenhouse,,Software Engineering,Entry Level
"Staff Software Engineer, Data Movement",stripe,"Seattle, US Remote, NYC ",https://stripe.com/jobs/search?gh_jid=6345510,2025-10-06T13:23:20-04:00,greenhouse,,Software Engineering,Entry Level
"Staff Software Engineer, Data Transformation",stripe,"US remote, SF, Seattle ",https://stripe.com/jobs/search?gh_jid=7300600,2025-10-15T15:31:04-04:00,greenhouse,,Software Engineering,Entry Level
Strategic Pursuits Specialist,stripe,"SF, Chicago, NYC, US Remote",https://stripe.com/jobs/search?gh_jid=6683108,2025-10-15T15:29:58-04:00,greenhouse,,Software Engineering,Entry Level
"Treasury Finance Specialist, Americas",stripe,New York City,https://stripe.com/jobs/search?gh_jid=7275262,2025-10-13T18:22:13-04:00,greenhouse,,Software Engineering,Entry Level
"Control Plane - Serverless Applications - Software Engineer II (Go, K8s)",elastic,United States,https://jobs.elastic.co/jobs?gh_jid=7228778&gh_jid=7228778,2025-09-30T11:38:52-04:00,greenhouse,,Software Engineering,Entry Level
Control Plane - Site Reliability Engineer (Hosted Infrastructure),elastic,Australia,https://jobs.elastic.co/jobs?gh_jid=7257125&gh_jid=7257125,2025-09-23T21:24:46-04:00,greenhouse,,Software Engineering,Entry Level
"Elasticsearch - Principal Software Engineer II - Query Engine, Database Internals",elastic,United States,https://jobs.elastic.co/jobs?gh_jid=7010276&gh_jid=7010276,2025-09-05T18:39:54-04:00,greenhouse,,Software Engineering,Entry Level
Elasticsearch - Principal Software Engineer II - Vector Search,elastic,United States,https://jobs.elastic.co/jobs?gh_jid=7201362&gh_jid=7201362,2025-09-08T09:09:44-04:00,greenhouse,,Software Engineering,Entry Level
Elasticsearch - Principal Software Engineer - Search Algorithms,elastic,United States,https://jobs.elastic.co/jobs?gh_jid=7314504&gh_jid=7314504,2025-10-10T11:54:09-04:00,greenhouse,,Software Engineering,Entry Level
Elasticsearch - Principal Software Engineer - Vector Search,elastic,United States,https://jobs.elastic.co/jobs?gh_jid=7314526&gh_jid=7314526,2025-10-10T11:54:11-04:00,greenhouse,,Software Engineering,Entry Level
Elasticsearch - Senior Java Engineer - Distributed Systems,elastic,United States,https://jobs.elastic.co/jobs?gh_jid=7241967&gh_jid=7241967,2025-09-10T06:39:49-04:00,greenhouse,,Software Engineering,Entry Level
Engineering Manager - Website Engineering,elastic,United States,https://jobs.elastic.co/jobs?gh_jid=7295454&gh_jid=7295454,2025-10-06T21:19:49-04:00,greenhouse,,Software Engineering,Entry Level
"FP&A Analyst, Product Finance",elastic,United States,https://jobs.elastic.co/jobs?gh_jid=7271388&gh_jid=7271388,2025-10-01T10:36:59-04:00,greenhouse,,Software Engineering,Entry Level
InfoSec -Principal Information Security Architect,elastic,United States,https://jobs.elastic.co/jobs?gh_jid=7201358&gh_jid=7201358,2025-10-07T13:19:40-04:00,greenhouse,,Cybersecurity,Entry Level
IT - Integration Engineer,elastic,United States,https://jobs.elastic.co/jobs?gh_jid=7193863&gh_jid=7193863,2025-09-24T18:42:51-04:00,greenhouse,,Software Engineering,Entry Level
"IT Program Management Analyst â€“ Risk, Compliance and Security",elastic,United States,https://jobs.elastic.co/jobs?gh_jid=7257387&gh_jid=7257387,2025-10-09T13:37:57-04:00,greenhouse,,Cybersecurity,Entry Level
"Lead Data Analyst, Sales Strategy & Finance",elastic,United States,https://jobs.elastic.co/jobs?gh_jid=7002916&gh_jid=7002916,2025-10-15T18:54:02-04:00,greenhouse,,Software Engineering,Entry Level
Platform - Senior Cloud Security Engineer,elastic,United States,https://jobs.elastic.co/jobs?gh_jid=7202754&gh_jid=7202754,2025-09-25T18:10:04-04:00,greenhouse,,Cybersecurity,Entry Level
"Principal Software Engineer II - Elasticsearch - Query Engine, Database Internals",elastic,United States,https://jobs.elastic.co/jobs?gh_jid=7282461&gh_jid=7282461,2025-09-29T10:05:39-04:00,greenhouse,,Software Engineering,Entry Level
"Senior Analyst, Technical Accounting and Financial Reporting",elastic,United States,https://jobs.elastic.co/jobs?gh_jid=7140736&gh_jid=7140736,2025-09-05T18:28:24-04:00,greenhouse,,Software Engineering,Entry Level
Senior Developer Advocate,elastic,"New York City, NY",https://jobs.elastic.co/jobs?gh_jid=7263056&gh_jid=7263056,2025-09-24T17:31:30-04:00,greenhouse,,Software Engineering,Entry Level
Senior Security Engineer -  Data Science,elastic,United States,https://jobs.elastic.co/jobs?gh_jid=6950233&gh_jid=6950233,2025-09-05T18:39:54-04:00,greenhouse,,Cybersecurity,Entry Level
"Specialist, Analyst Relations",elastic,United States,https://jobs.elastic.co/jobs?gh_jid=7297838&gh_jid=7297838,2025-10-03T20:41:02-04:00,greenhouse,,Software Engineering,Entry Level
AI Revenue Operations Analyst,gitlab,"Remote, Canada; Remote, US",https://job-boards.greenhouse.io/gitlab/jobs/8192245002,2025-10-07T13:01:33-04:00,greenhouse,,Software Engineering,Entry Level
"Customer Success Engineer, EMEA",gitlab,"Remote, Germany; Remote, Netherlands; Remote, United Kingdom",https://job-boards.greenhouse.io/gitlab/jobs/8173178002,2025-10-13T05:18:29-04:00,greenhouse,,Software Engineering,Entry Level
Developer Relations Program Manager ,gitlab,"Remote, EMEA",https://job-boards.greenhouse.io/gitlab/jobs/8155496002,2025-10-07T13:01:33-04:00,greenhouse,,Software Engineering,Entry Level
"Engineering Manager, Software Supply Chain Security: Auth Infrastructure",gitlab,"Remote, Canada; Remote, EMEA; Remote, US",https://job-boards.greenhouse.io/gitlab/jobs/8158501002,2025-10-07T13:01:33-04:00,greenhouse,,Cybersecurity,Entry Level
"Intermediate Backend Engineer (Golang), Application Security Testing: Composition Analysis",gitlab,"Remote, EMEA; Remote, North America",https://job-boards.greenhouse.io/gitlab/jobs/8174207002,2025-10-07T13:01:33-04:00,greenhouse,,Cybersecurity,Entry Level
"Intermediate Backend Engineer (Golang), Monitor: Platform Insights",gitlab,"Remote, APAC",https://job-boards.greenhouse.io/gitlab/jobs/7916259002,2025-10-07T13:01:33-04:00,greenhouse,,Software Engineering,Entry Level
"Intermediate Backend Engineer (Python), AI Framework",gitlab,"Remote, Canada; Remote, Europe",https://job-boards.greenhouse.io/gitlab/jobs/8144981002,2025-10-10T05:55:46-04:00,greenhouse,,Software Engineering,Entry Level
"Intermediate Backend Engineer (RoR), Security Risk Management: Security Insights",gitlab,"Remote, EMEA; Remote, North America",https://job-boards.greenhouse.io/gitlab/jobs/8174189002,2025-10-07T13:01:33-04:00,greenhouse,,Cybersecurity,Entry Level
"Intermediate Backend Engineer (Ruby), Verify: CI Platform",gitlab,"Remote, Canada; Remote, EMEA; Remote, Netherlands; Remote, United Kingdom",https://job-boards.greenhouse.io/gitlab/jobs/8187023002,2025-10-10T05:56:14-04:00,greenhouse,,Software Engineering,Entry Level
"Intermediate Backend Engineer (Ruby), Verify:Pipeline Authoring",gitlab,"Remote, Canada; Remote, EMEA; Remote, Netherlands; Remote, United Kingdom",https://job-boards.greenhouse.io/gitlab/jobs/8187011002,2025-10-10T05:56:48-04:00,greenhouse,,Software Engineering,Entry Level
"Intermediate Backend (Ruby/Go) Engineer, GitLab Delivery: Operate",gitlab,"Remote, Americas; Remote, APAC; Remote, EMEA",https://job-boards.greenhouse.io/gitlab/jobs/8094585002,2025-10-07T13:01:33-04:00,greenhouse,,Software Engineering,Entry Level
"Intermediate Backend (Ruby or Go) Engineer, Gitlab Delivery - Operate",gitlab,Remote,https://job-boards.greenhouse.io/gitlab/jobs/8093927002,2025-10-07T13:01:33-04:00,greenhouse,,Software Engineering,Entry Level
"Intermediate Frontend Engineer (Vue.js), Plan: Product Planning ",gitlab,Remote,https://job-boards.greenhouse.io/gitlab/jobs/8199086002,2025-10-10T08:27:00-04:00,greenhouse,,Software Engineering,Entry Level
"Intermediate Fullstack Engineer (Ruby on Rails & Vue.js), Plan: Knowledge",gitlab,"Remote, APAC; Remote, EMEA",https://job-boards.greenhouse.io/gitlab/jobs/8157484002,2025-10-07T13:01:33-04:00,greenhouse,,Software Engineering,Entry Level
"Intermediate Fullstack Engineer (Ruby/Vue.js), AI Engineering, Custom Models",gitlab,"Remote, Americas; Remote, EMEA",https://job-boards.greenhouse.io/gitlab/jobs/8207075002,2025-10-14T05:35:16-04:00,greenhouse,,Software Engineering,Entry Level
"Intermediate Fullstack Engineer (Ruby/Vue.js), Analytics Instrumentation ",gitlab,"Remote, Canada; Remote, EMEA; Remote, Europe; Remote, Netherlands; Remote, United Kingdom",https://job-boards.greenhouse.io/gitlab/jobs/8161980002,2025-10-14T04:08:08-04:00,greenhouse,,Software Engineering,Entry Level
"Intermediate Fullstack Engineer (Ruby/Vue.js), Growth",gitlab,"Remote, EMEA; Remote, Europe; Remote, Netherlands; Remote, United Kingdom",https://job-boards.greenhouse.io/gitlab/jobs/8162062002,2025-10-14T04:08:42-04:00,greenhouse,,Software Engineering,Entry Level
"Intermediate Security Engineer, Security Incident Response Team",gitlab,"Remote, Australia",https://job-boards.greenhouse.io/gitlab/jobs/8160669002,2025-10-07T13:01:33-04:00,greenhouse,,Cybersecurity,Entry Level
"Intermediate Site Reliability Engineer, Database Operations",gitlab,"Remote, EMEA",https://job-boards.greenhouse.io/gitlab/jobs/8199072002,2025-10-09T07:01:55-04:00,greenhouse,,Software Engineering,Entry Level
"Intermediate Site Reliability Engineer, Database Operations",gitlab,"Remote, Canada; Remote, New Zealand",https://job-boards.greenhouse.io/gitlab/jobs/8092087002,2025-10-07T13:01:33-04:00,greenhouse,,Software Engineering,Entry Level
"Intermediate Site Reliability Engineer, GitLab Delivery - Release and Deploy",gitlab,"Remote, EMEA",https://job-boards.greenhouse.io/gitlab/jobs/8199059002,2025-10-08T01:11:49-04:00,greenhouse,,Software Engineering,Entry Level
"Intermediate Site Reliability Engineer, Networking and Incident Management",gitlab,"Remote, APAC; Remote, EMEA",https://job-boards.greenhouse.io/gitlab/jobs/8157437002,2025-10-07T13:01:33-04:00,greenhouse,,Software Engineering,Entry Level
"Intermediate Software Security Engineer, Trust and Safety",gitlab,"Remote, APAC; Remote, EMEA",https://job-boards.greenhouse.io/gitlab/jobs/8168267002,2025-10-07T13:01:33-04:00,greenhouse,,Cybersecurity,Entry Level
"Manager, Product Security Engineering ",gitlab,"Remote, Global",https://job-boards.greenhouse.io/gitlab/jobs/8200907002,2025-10-10T12:02:43-04:00,greenhouse,,Cybersecurity,Entry Level
"Principal Data System Architect, Data Engineering & Monetization",gitlab,"Remote, Canada; Remote, EMEA; Remote, US",https://job-boards.greenhouse.io/gitlab/jobs/8101402002,2025-10-07T13:01:33-04:00,greenhouse,,Software Engineering,Entry Level
"Principal Engineer, Production Engineering",gitlab,Remote,https://job-boards.greenhouse.io/gitlab/jobs/8177550002,2025-10-07T13:01:33-04:00,greenhouse,,Software Engineering,Entry Level
"Principal Security Engineer, Application Security ",gitlab,"Remote, APAC; Remote, EMEA; Remote, North America; Remote, US",https://job-boards.greenhouse.io/gitlab/jobs/8196202002,2025-10-10T15:01:25-04:00,greenhouse,,Cybersecurity,Entry Level
"Principal Software Engineer, Group Tenant Scale",gitlab,Remote,https://job-boards.greenhouse.io/gitlab/jobs/8177580002,2025-10-07T13:01:33-04:00,greenhouse,,Software Engineering,Entry Level
"Salesforce Admin/Release Engineer, CRM Systems",gitlab,"Remote, APAC",https://job-boards.greenhouse.io/gitlab/jobs/8171608002,2025-10-07T13:01:33-04:00,greenhouse,,Software Engineering,Entry Level
"Senior Backend Engineer, Data Frameworks (Ruby)",gitlab,"Remote, APAC; Remote, Canada; Remote, EMEA",https://job-boards.greenhouse.io/gitlab/jobs/8190196002,2025-10-09T16:20:12-04:00,greenhouse,,Software Engineering,Entry Level
"Senior Backend Engineer (Golang), SSCS: Authentication ",gitlab,"Remote, Americas; Remote, APAC; Remote, Canada",https://job-boards.greenhouse.io/gitlab/jobs/8157520002,2025-10-07T13:01:33-04:00,greenhouse,,Software Engineering,Entry Level
"Senior Backend Engineer (RoR), Security Risk Management: Platform Management",gitlab,Remote,https://job-boards.greenhouse.io/gitlab/jobs/8174779002,2025-10-07T13:01:33-04:00,greenhouse,,Cybersecurity,Entry Level
"Senior Backend Engineer (Ruby), Monitor: Platform Insights ",gitlab,"Remote, India",https://job-boards.greenhouse.io/gitlab/jobs/8114955002,2025-10-10T05:55:59-04:00,greenhouse,,Software Engineering,Entry Level
"Senior Frontend Engineer (Vue.js), Workflow Catalog ",gitlab,"Remote, Canada; Remote, Netherlands; Remote, United Kingdom",https://job-boards.greenhouse.io/gitlab/jobs/8162003002,2025-10-14T04:09:25-04:00,greenhouse,,Software Engineering,Entry Level
"Senior Integration Engineer, RPA UiPath",gitlab,"Remote, APAC",https://job-boards.greenhouse.io/gitlab/jobs/8023318002,2025-10-07T13:01:33-04:00,greenhouse,,Software Engineering,Entry Level
"Senior Manager, Developer Advocacy",gitlab,"Remote, North America",https://job-boards.greenhouse.io/gitlab/jobs/8168744002,2025-10-15T16:22:14-04:00,greenhouse,,Software Engineering,Entry Level
"Senior Security Engineer, Application Security ",gitlab,"Remote, EMEA",https://job-boards.greenhouse.io/gitlab/jobs/8195857002,2025-10-10T09:52:03-04:00,greenhouse,,Cybersecurity,Entry Level
Senior Security Engineer - Enterprise AI Security,gitlab,"Remote, APAC; Remote, Canada; Remote, US",https://job-boards.greenhouse.io/gitlab/jobs/8191574002,2025-10-07T13:01:33-04:00,greenhouse,,Cybersecurity,Entry Level
"Senior Security Engineer, Security Incident Response Team",gitlab,"Remote, EMEA",https://job-boards.greenhouse.io/gitlab/jobs/8160702002,2025-10-07T13:01:33-04:00,greenhouse,,Cybersecurity,Entry Level
"Senior Site Reliability Engineer, Database Operations   ",gitlab,"Remote, Canada; Remote, EMEA",https://job-boards.greenhouse.io/gitlab/jobs/8192875002,2025-10-13T07:35:07-04:00,greenhouse,,Software Engineering,Entry Level
"Senior Site Reliability Engineer, Environment Automation",gitlab,"Remote, Canada",https://job-boards.greenhouse.io/gitlab/jobs/8136108002,2025-10-07T13:01:33-04:00,greenhouse,,Software Engineering,Entry Level
"Senior Site Reliability Engineer, Environment Automation",gitlab,"Remote, Australia",https://job-boards.greenhouse.io/gitlab/jobs/8136591002,2025-10-07T13:01:33-04:00,greenhouse,,Software Engineering,Entry Level
"Senior Site Reliability Engineer, US Public Sector Services",gitlab,"Remote, US",https://job-boards.greenhouse.io/gitlab/jobs/8189499002,2025-10-07T13:01:33-04:00,greenhouse,,Software Engineering,Entry Level
"Software Engineering Manager, Application Security Testing: Composition Analysis & Dynamic Analysis",gitlab,Remote,https://job-boards.greenhouse.io/gitlab/jobs/8002169002,2025-10-07T13:01:33-04:00,greenhouse,,Cybersecurity,Entry Level
"Software Engineering Manager, Cells Infrastructure",gitlab,"Remote, Canada; Remote, EMEA",https://job-boards.greenhouse.io/gitlab/jobs/8175536002,2025-10-07T13:01:33-04:00,greenhouse,,Software Engineering,Entry Level
"Staff Backend Engineer, Create: Code Creation (Ruby and Python)",gitlab,Remote,https://job-boards.greenhouse.io/gitlab/jobs/8199789002,2025-10-15T08:30:48-04:00,greenhouse,,Software Engineering,Entry Level
"Staff Backend Engineer, Developer Experience (Ruby)",gitlab,"Remote, APAC; Remote, Canada; Remote, EMEA; Remote, Netherlands; Remote, United Kingdom",https://job-boards.greenhouse.io/gitlab/jobs/8199765002,2025-10-09T16:27:06-04:00,greenhouse,,Software Engineering,Entry Level
"Staff Fullstack Engineer (Python/Vue.js), AI Engineering: Duo Chat",gitlab,"Remote, Americas; Remote, EMEA",https://job-boards.greenhouse.io/gitlab/jobs/8202813002,2025-10-13T03:54:00-04:00,greenhouse,,Software Engineering,Entry Level
