title,company,location,url,posted_date,provider,description,role_category,level
"Sr. Software Engineer, Backend",pinterest,"Mexico City, MX; Remote, MX",https://www.pinterestcareers.com/jobs/?gh_jid=6087228,2025-10-02T12:19:14-04:00,greenhouse,,Software Engineering,Entry Level
"Sr. Software Engineer, Full Stack",pinterest,"Mexico City, MX; Remote, MX",https://www.pinterestcareers.com/jobs/?gh_jid=6142105,2025-10-02T12:19:14-04:00,greenhouse,,Software Engineering,Entry Level
"Sr Staff Machine Learning Engineer, Closeup Relevance ",pinterest,"Palo Alto, CA; Seattle, WA US",https://www.pinterestcareers.com/jobs/?gh_jid=6482944,2025-10-02T12:19:14-04:00,greenhouse,,Software Engineering,Entry Level
"Sr. Staff Machine Learning Engineer, Homefeed",pinterest,"San Francisco, CA, US; Remote, US",https://www.pinterestcareers.com/jobs/?gh_jid=6908633,2025-10-02T12:19:14-04:00,greenhouse,,Software Engineering,Entry Level
"Sr. Staff Machine Learning Engineer, Search",pinterest,"San Francisco, CA, US; Remote, US",https://www.pinterestcareers.com/jobs/?gh_jid=6992375,2025-10-02T12:19:14-04:00,greenhouse,,Software Engineering,Entry Level
"Sr. Staff Software Engineer, Conversion Visibility",pinterest,"San Francisco, CA, US; Remote, US",https://www.pinterestcareers.com/jobs/?gh_jid=6963813,2025-10-02T12:19:14-04:00,greenhouse,,Software Engineering,Entry Level
"Sr. Staff Software Engineer, Core Retrieval Infrastructure",pinterest,"San Francisco, CA, US; Palo Alto, CA, US; Seattle, WA, US ",https://www.pinterestcareers.com/jobs/?gh_jid=6867844,2025-10-02T12:19:14-04:00,greenhouse,,Software Engineering,Entry Level
"Sr. Staff Software Engineering, Ads Serving Infrastructure",pinterest,"San Francisco, CA , US; Palo Alto, CA, US; Seattle, WA;US; New York, NY, US",https://www.pinterestcareers.com/jobs/?gh_jid=7022246,2025-10-15T10:10:57-04:00,greenhouse,,Software Engineering,Entry Level
"Staff Backend Software Engineer, Curation",pinterest,"San Francisco, CA, US; Palo Alto,Ca; Seattle,WA; Remote, US",https://www.pinterestcareers.com/jobs/?gh_jid=7179561,2025-10-14T14:28:23-04:00,greenhouse,,Software Engineering,Entry Level
"Staff Machine Learning Engineer, Ads Delivery",pinterest,"San Francisco, CA, US; Palo Alto, CA, US; Seattle, WA, US",https://www.pinterestcareers.com/jobs/?gh_jid=6482871,2025-10-02T12:19:14-04:00,greenhouse,,Software Engineering,Entry Level
"Staff Machine Learning Engineer, Ads Late Funnel",pinterest,"San Francisco, CA, US; Seattle, WA, US",https://www.pinterestcareers.com/jobs/?gh_jid=7012050,2025-10-02T12:19:14-04:00,greenhouse,,Software Engineering,Entry Level
Staff Machine Learning Engineer - Ads Modules,pinterest,"San Francisco, CA, US; Palo Alto, CA, US; Seattle, WA, US",https://www.pinterestcareers.com/jobs/?gh_jid=6708191,2025-10-02T12:19:14-04:00,greenhouse,,Software Engineering,Entry Level
"Staff Machine Learning Engineer, Content Recommendations ",pinterest,"Toronto, ON, CA; Remote, CA",https://www.pinterestcareers.com/jobs/?gh_jid=7261464,2025-10-15T11:01:06-04:00,greenhouse,,Software Engineering,Entry Level
"Staff Machine Learning Engineer, Monetization",pinterest,"San Francisco, CA, US; Palo Alto, CA, US; Seattle, WA, US",https://www.pinterestcareers.com/jobs/?gh_jid=6133257,2025-10-02T12:19:14-04:00,greenhouse,,Software Engineering,Entry Level
Staff Machine Learning Engineer - Responsible AI,pinterest,"Palo Alto, CA, US; San Francisco, CA, US; Remote, US",https://www.pinterestcareers.com/jobs/?gh_jid=6371685,2025-10-08T13:30:29-04:00,greenhouse,,Software Engineering,Entry Level
"Staff Machine Learning Engineer, Search",pinterest,"San Francisco, CA, US; Remote, US",https://www.pinterestcareers.com/jobs/?gh_jid=6708115,2025-10-02T12:19:14-04:00,greenhouse,,Software Engineering,Entry Level
"Staff Product Manager, Content Understanding - Machine Learning",pinterest,"Seattle, WA, US; Remote, US",https://www.pinterestcareers.com/jobs/?gh_jid=7168801,2025-10-02T12:19:14-04:00,greenhouse,,Software Engineering,Entry Level
"Staff Software Engineer, Batch Processing Platform",pinterest,"Seattle, WA, US; Remote, US",https://www.pinterestcareers.com/jobs/?gh_jid=7239289,2025-10-02T12:19:14-04:00,greenhouse,,Software Engineering,Entry Level
"Staff Software Engineer, Capacity Engineering",pinterest,"San Francisco, CA, US; Remote, US",https://www.pinterestcareers.com/jobs/?gh_jid=7167271,2025-10-07T16:59:30-04:00,greenhouse,,Software Engineering,Entry Level
"Staff Software Engineer, Core Serving Infra",pinterest,"San Francisco, CA, US; Remote, US",https://www.pinterestcareers.com/jobs/?gh_jid=6482939,2025-10-02T12:19:14-04:00,greenhouse,,Software Engineering,Entry Level
"Staff Software Engineer, LLM Internal Tooling",pinterest,"San Francisco, CA, US; Remote, US",https://www.pinterestcareers.com/jobs/?gh_jid=7005399,2025-10-02T12:19:14-04:00,greenhouse,,Software Engineering,Entry Level
Application Security Engineer,airbnb,United States,https://careers.airbnb.com/positions/7178910?gh_jid=7178910,2025-10-08T14:08:45-04:00,greenhouse,,Cybersecurity,Entry Level
"Engineering Manager, Data Frameworks",airbnb,Remote - US,https://careers.airbnb.com/positions/7271799?gh_jid=7271799,2025-10-08T14:08:45-04:00,greenhouse,,Software Engineering,Entry Level
"Engineering Manager, Host Pricing - Product UI Foundations",airbnb,United States,https://careers.airbnb.com/positions/7277976?gh_jid=7277976,2025-10-14T14:16:58-04:00,greenhouse,,Software Engineering,Entry Level
"Engineering Manager, Media Foundation: Ingestion & Serving Team",airbnb,CA - Remote,https://careers.airbnb.com/positions/7217178?gh_jid=7217178,2025-10-08T14:08:45-04:00,greenhouse,,Software Engineering,Entry Level
"iOS Software Engineer, Guest & Host",airbnb,"Remote, USA",https://careers.airbnb.com/positions/7336167?gh_jid=7336167,2025-10-15T17:01:47-04:00,greenhouse,,Software Engineering,Entry Level
"Manager, Engineering - Community Support Engineering",airbnb,"San Francisco, CA",https://careers.airbnb.com/positions/7176142?gh_jid=7176142,2025-10-08T14:08:45-04:00,greenhouse,,Software Engineering,Entry Level
"Senior Business Solutions Engineer, BizTech",airbnb,United States,https://careers.airbnb.com/positions/7306160?gh_jid=7306160,2025-10-08T14:08:45-04:00,greenhouse,,Software Engineering,Entry Level
Senior Fullstack Engineer Community Support Engineering,airbnb,"Remote, USA ",https://careers.airbnb.com/positions/6856155?gh_jid=6856155,2025-10-08T14:08:45-04:00,greenhouse,,Software Engineering,Entry Level
"Senior Machine Learning Engineer, Relevance and Personalization",airbnb,United States,https://careers.airbnb.com/positions/7258033?gh_jid=7258033,2025-10-13T16:15:52-04:00,greenhouse,,Software Engineering,Entry Level
"Senior Manager, Software Engineering - Security",airbnb,Remote - USA,https://careers.airbnb.com/positions/6752751?gh_jid=6752751,2025-10-08T14:08:45-04:00,greenhouse,,Cybersecurity,Entry Level
"Senior Security Engineer, Threat Detection & Response",airbnb,United States,https://careers.airbnb.com/positions/7134785?gh_jid=7134785,2025-10-08T14:08:45-04:00,greenhouse,,Cybersecurity,Entry Level
"Senior Software Engineer, Android Platform",airbnb,Remote - USA,https://careers.airbnb.com/positions/7233106?gh_jid=7233106,2025-10-08T14:08:45-04:00,greenhouse,,Software Engineering,Entry Level
"Senior Software Engineer, Host Pricing & Settings",airbnb,Remote USA,https://careers.airbnb.com/positions/6718415?gh_jid=6718415,2025-10-08T14:08:45-04:00,greenhouse,,Software Engineering,Entry Level
"Senior Specialist, Premium Support (Spanish)",airbnb,"Nevada, United States",https://careers.airbnb.com/positions/7187237?gh_jid=7187237,2025-10-08T14:08:45-04:00,greenhouse,,Software Engineering,Entry Level
Senior Staff Engineer - Cloud Infrastructure (Compute),airbnb,Remote - USA,https://careers.airbnb.com/positions/7276961?gh_jid=7276961,2025-10-08T14:08:45-04:00,greenhouse,,Software Engineering,Entry Level
Senior Staff Machine Learning Engineer - AI Safety and Guardrail ,airbnb,United States,https://careers.airbnb.com/positions/7159569?gh_jid=7159569,2025-10-08T14:08:45-04:00,greenhouse,,Software Engineering,Entry Level
"Senior Staff Machine Learning Engineer, Communication & Connectivity",airbnb,Remote - USA,https://careers.airbnb.com/positions/7005605?gh_jid=7005605,2025-10-08T14:08:45-04:00,greenhouse,,Software Engineering,Entry Level
"Senior Staff Machine Learning Engineer, Community Support Engineering",airbnb,United States,https://careers.airbnb.com/positions/6757302?gh_jid=6757302,2025-10-08T14:08:45-04:00,greenhouse,,Software Engineering,Entry Level
Senior Staff Machine Learning Engineer â€“ GenAI,airbnb,United States,https://careers.airbnb.com/positions/7028263?gh_jid=7028263,2025-10-08T14:08:45-04:00,greenhouse,,Software Engineering,Entry Level
Senior Staff Machine Learning Engineer - Guest & Host,airbnb,United States,https://careers.airbnb.com/positions/6817373?gh_jid=6817373,2025-10-08T14:08:45-04:00,greenhouse,,Software Engineering,Entry Level
"Senior Staff Machine Learning Engineer, Relevance and Personalization",airbnb,United States,https://careers.airbnb.com/positions/6237467?gh_jid=6237467,2025-10-13T16:22:16-04:00,greenhouse,,Software Engineering,Entry Level
"Staff Data Platform Engineer, Community Support Platform",airbnb,REMOTE - US,https://careers.airbnb.com/positions/7183500?gh_jid=7183500,2025-10-08T14:08:45-04:00,greenhouse,,Software Engineering,Entry Level
"Staff iOS Engineer, Client Products & Emerging Tech",airbnb,"Remote, USA",https://careers.airbnb.com/positions/7277871?gh_jid=7277871,2025-10-08T14:08:45-04:00,greenhouse,,Software Engineering,Entry Level
"Staff iOS Engineer, Guest & Host",airbnb,Remote United States,https://careers.airbnb.com/positions/6854729?gh_jid=6854729,2025-10-08T14:08:45-04:00,greenhouse,,Software Engineering,Entry Level
"Staff Machine Learning Engineer, AI Translation ",airbnb,United States,https://careers.airbnb.com/positions/6838683?gh_jid=6838683,2025-10-13T13:15:31-04:00,greenhouse,,Software Engineering,Entry Level
Staff Machine Learning Engineer - Community Support Engineering,airbnb,Remote - USA,https://careers.airbnb.com/positions/7116975?gh_jid=7116975,2025-10-08T14:08:45-04:00,greenhouse,,Software Engineering,Entry Level
"Staff Machine Learning Engineer, Payments",airbnb,United States,https://careers.airbnb.com/positions/7121624?gh_jid=7121624,2025-10-08T14:08:45-04:00,greenhouse,,Software Engineering,Entry Level
"Staff Security Engineer, Data Security",airbnb,United States,https://careers.airbnb.com/positions/7158734?gh_jid=7158734,2025-10-08T14:08:45-04:00,greenhouse,,Cybersecurity,Entry Level
"Staff Software Engineer, Android Platform",airbnb,Remote - USA,https://careers.airbnb.com/positions/7235415?gh_jid=7235415,2025-10-08T14:08:45-04:00,greenhouse,,Software Engineering,Entry Level
"Staff Software Engineer, Experimentation Data",airbnb,Remote USA,https://careers.airbnb.com/positions/7306868?gh_jid=7306868,2025-10-10T17:17:02-04:00,greenhouse,,Software Engineering,Entry Level
"Staff Software Engineer, Growth Platform",airbnb,"Remote, USA ",https://careers.airbnb.com/positions/6886222?gh_jid=6886222,2025-10-08T14:08:45-04:00,greenhouse,,Software Engineering,Entry Level
"Staff Software Engineer, Guest & Host - Pricing Guidance Team",airbnb,"Remote, USA",https://careers.airbnb.com/positions/6741839?gh_jid=6741839,2025-10-08T14:08:45-04:00,greenhouse,,Software Engineering,Entry Level
"Staff Software Engineer, Integrated Knowledge Management (RAG)",airbnb,Remote - USA,https://careers.airbnb.com/positions/6871719?gh_jid=6871719,2025-10-08T14:08:45-04:00,greenhouse,,Software Engineering,Entry Level
"Staff Software Engineer, Performance ",airbnb,Remote - USA,https://careers.airbnb.com/positions/6996864?gh_jid=6996864,2025-10-08T14:08:45-04:00,greenhouse,,Software Engineering,Entry Level
"Staff Software Engineer, Trust",airbnb,"Remote, USA ",https://careers.airbnb.com/positions/7116604?gh_jid=7116604,2025-10-08T14:08:45-04:00,greenhouse,,Software Engineering,Entry Level
"2026 - Software Engineering Intern, AMER",mongodb,Austin; New York City; Palo Alto; San Francisco; Seattle,https://www.mongodb.com/careers/job/?gh_jid=7239454,2025-10-13T17:07:31-04:00,greenhouse,,Software Engineering,Entry Level
AV Engineer 3,mongodb,New York City,https://www.mongodb.com/careers/job/?gh_jid=6966483,2025-10-13T17:07:31-04:00,greenhouse,,Software Engineering,Entry Level
"Engineering Manager, Atlas Search",mongodb,San Francisco,https://www.mongodb.com/careers/job/?gh_jid=7201364,2025-10-13T17:07:31-04:00,greenhouse,,Software Engineering,Entry Level
"Engineering Manager, Query",mongodb,United States,https://www.mongodb.com/careers/job/?gh_jid=7229699,2025-10-13T17:07:31-04:00,greenhouse,,Software Engineering,Entry Level
Escalation Engineer,mongodb,New York City; United States,https://www.mongodb.com/careers/job/?gh_jid=7209916,2025-10-13T17:07:31-04:00,greenhouse,,Software Engineering,Entry Level
"Forward Deployed Engineer, AI",mongodb,Austin; Boston; Chicago; New York City; San Francisco,https://www.mongodb.com/careers/job/?gh_jid=7123769,2025-10-13T17:07:31-04:00,greenhouse,,Software Engineering,Entry Level
"Forward Deployed Engineer, AI",mongodb,United States,https://www.mongodb.com/careers/job/?gh_jid=7180116,2025-10-13T17:07:31-04:00,greenhouse,,Software Engineering,Entry Level
"Group Product Manager, Growth & Developer Experience",mongodb,Austin; Chicago; Miami; New York City; Seattle; United States; Washington DC,https://www.mongodb.com/careers/job/?gh_jid=7158505,2025-10-13T17:07:31-04:00,greenhouse,,Software Engineering,Entry Level
"Lead Engineer, Atlas Clusters",mongodb,New York City,https://www.mongodb.com/careers/job/?gh_jid=7271659,2025-10-13T17:07:31-04:00,greenhouse,,Software Engineering,Entry Level
"Lead Engineer, Server Programmability",mongodb,United States,https://www.mongodb.com/careers/job/?gh_jid=7201997,2025-10-13T17:07:31-04:00,greenhouse,,Software Engineering,Entry Level
"Product Security Engineer, Server",mongodb,New York City; United States,https://www.mongodb.com/careers/job/?gh_jid=7134662,2025-10-13T17:07:31-04:00,greenhouse,,Cybersecurity,Entry Level
"Senior Analyst, Sales Strategy & Planning",mongodb,New York City,https://www.mongodb.com/careers/job/?gh_jid=7144712,2025-10-13T17:07:31-04:00,greenhouse,,Software Engineering,Entry Level
"Senior Business Analyst, Technical Services",mongodb,New York City,https://www.mongodb.com/careers/job/?gh_jid=6841436,2025-10-13T17:07:31-04:00,greenhouse,,Software Engineering,Entry Level
Senior Business Operations & Strategy Analyst,mongodb,New York City,https://www.mongodb.com/careers/job/?gh_jid=7128879,2025-10-13T17:07:31-04:00,greenhouse,,Software Engineering,Entry Level
Senior Consulting Engineer,mongodb,Arizona; Las Vegas; Los Angeles; Oregon; Washington,https://www.mongodb.com/careers/job/?gh_jid=7228317,2025-10-13T17:07:31-04:00,greenhouse,,Software Engineering,Entry Level
Senior Consulting Engineer,mongodb,Atlanta; Boston; Charlotte; Florida; Michigan; New York; Texas; Tysons; Washington DC,https://www.mongodb.com/careers/job/?gh_jid=7178812,2025-10-13T17:07:31-04:00,greenhouse,,Software Engineering,Entry Level
Senior Consulting Engineer - Professional Services,mongodb,Los Angeles; Nevada; Phoenix,https://www.mongodb.com/careers/job/?gh_jid=7250554,2025-10-13T17:07:31-04:00,greenhouse,,Software Engineering,Entry Level
"Senior Data Analyst II, GTM & Sales",mongodb,New York City,https://www.mongodb.com/careers/job/?gh_jid=7216736,2025-10-13T17:07:31-04:00,greenhouse,,Software Engineering,Entry Level
"Senior Engineer, Storage Layer Services",mongodb,United States,https://www.mongodb.com/careers/job/?gh_jid=6477783,2025-10-13T17:07:31-04:00,greenhouse,,Software Engineering,Entry Level
Senior Fullstack Engineer - Atlas Growth,mongodb,New York City,https://www.mongodb.com/careers/job/?gh_jid=7093030,2025-10-13T17:07:31-04:00,greenhouse,,Software Engineering,Entry Level
"Senior InfoSec Engineer, Red Team",mongodb,New York City; San Francisco; Seattle; United States,https://www.mongodb.com/careers/job/?gh_jid=7280331,2025-10-13T17:07:31-04:00,greenhouse,,Cybersecurity,Entry Level
"Senior Product Security Engineer, Cloud",mongodb,New York City; Seattle; United States,https://www.mongodb.com/careers/job/?gh_jid=7216332,2025-10-13T17:07:31-04:00,greenhouse,,Cybersecurity,Entry Level
"Senior Product Security Engineer, Server",mongodb,New York City; Seattle; United States,https://www.mongodb.com/careers/job/?gh_jid=7202684,2025-10-13T17:07:31-04:00,greenhouse,,Cybersecurity,Entry Level
"Senior Site Reliability Engineer, Atlas",mongodb,Austin; Boston; Chicago; New York City; Pittsburgh,https://www.mongodb.com/careers/job/?gh_jid=6984809,2025-10-13T17:07:31-04:00,greenhouse,,Software Engineering,Entry Level
"Senior Site Reliability Engineer, Deployments",mongodb,United States,https://www.mongodb.com/careers/job/?gh_jid=6932221,2025-10-13T17:07:31-04:00,greenhouse,,Software Engineering,Entry Level
"Senior Site Reliability Engineer, Observability",mongodb,New York City; United States,https://www.mongodb.com/careers/job/?gh_jid=6711349,2025-10-13T17:07:31-04:00,greenhouse,,Software Engineering,Entry Level
Senior Software Engineer,mongodb,New York City,https://www.mongodb.com/careers/job/?gh_jid=7277030,2025-10-13T17:07:31-04:00,greenhouse,,Software Engineering,Entry Level
Senior Software Engineer,mongodb,San Francisco,https://www.mongodb.com/careers/job/?gh_jid=7263533,2025-10-15T12:34:54-04:00,greenhouse,,Software Engineering,Entry Level
"Senior Software Engineer, Atlas Async Runtime",mongodb,New York City; Seattle; United States,https://www.mongodb.com/careers/job/?gh_jid=7120612,2025-10-13T17:07:31-04:00,greenhouse,,Software Engineering,Entry Level
"Senior Software Engineer, Atlas Clusters",mongodb,New York City,https://www.mongodb.com/careers/job/?gh_jid=6925321,2025-10-13T17:07:31-04:00,greenhouse,,Software Engineering,Entry Level
"Senior Software Engineer, Atlas Clusters Security",mongodb,New York City,https://www.mongodb.com/careers/job/?gh_jid=7254433,2025-10-13T17:07:31-04:00,greenhouse,,Cybersecurity,Entry Level
"Senior Software Engineer, Cloud Payments ",mongodb,United States,https://www.mongodb.com/careers/job/?gh_jid=6720794,2025-10-13T17:07:31-04:00,greenhouse,,Software Engineering,Entry Level
"Senior Software Engineer, Developer Productivity",mongodb,Austin; New York City; United States,https://www.mongodb.com/careers/job/?gh_jid=7251403,2025-10-13T17:07:31-04:00,greenhouse,,Software Engineering,Entry Level
"Senior Software Engineer, Documentation Platform",mongodb,New York City; United States,https://www.mongodb.com/careers/job/?gh_jid=7124550,2025-10-13T17:07:31-04:00,greenhouse,,Software Engineering,Entry Level
"Senior Software Engineer, Frontend and AI",mongodb,New York City,https://www.mongodb.com/careers/job/?gh_jid=7304325,2025-10-13T17:07:31-04:00,greenhouse,,Software Engineering,Entry Level
"Senior Software Engineer, Frontend Platform",mongodb,New York City,https://www.mongodb.com/careers/job/?gh_jid=7283432,2025-10-13T17:07:31-04:00,greenhouse,,Software Engineering,Entry Level
"Senior Software Engineer, Inference Platform",mongodb,Palo Alto; Seattle,https://www.mongodb.com/careers/job/?gh_jid=6930755,2025-10-13T17:07:31-04:00,greenhouse,,Software Engineering,Entry Level
"Senior Software Engineer, MongoDB Server Clusters and Interfaces",mongodb,United States,https://www.mongodb.com/careers/job/?gh_jid=6749138,2025-10-13T17:07:31-04:00,greenhouse,,Software Engineering,Entry Level
"Senior Software Engineer, Replicated Storage Services",mongodb,United States,https://www.mongodb.com/careers/job/?gh_jid=6688527,2025-10-13T17:07:31-04:00,greenhouse,,Software Engineering,Entry Level
"Senior Software Engineer, Replicated Storage Services",mongodb,New York City,https://www.mongodb.com/careers/job/?gh_jid=6688894,2025-10-13T17:07:31-04:00,greenhouse,,Software Engineering,Entry Level
"Senior Staff Engineer, Cluster Scalability",mongodb,United States,https://www.mongodb.com/careers/job/?gh_jid=6394590,2025-10-13T17:07:31-04:00,greenhouse,,Software Engineering,Entry Level
"Senior Staff Engineer, Server Networking & Observability",mongodb,United States,https://www.mongodb.com/careers/job/?gh_jid=6713492,2025-10-13T17:07:31-04:00,greenhouse,,Software Engineering,Entry Level
"Senior Staff Engineer, Server Networking & Observability",mongodb,New York City,https://www.mongodb.com/careers/job/?gh_jid=6659380,2025-10-13T17:07:31-04:00,greenhouse,,Software Engineering,Entry Level
"Senior Staff Engineer, Server Networking & Observability",mongodb,Seattle,https://www.mongodb.com/careers/job/?gh_jid=6661893,2025-10-13T17:07:31-04:00,greenhouse,,Software Engineering,Entry Level
Site Reliability Engineer 3,mongodb,New York City,https://www.mongodb.com/careers/job/?gh_jid=7145126,2025-10-13T17:07:31-04:00,greenhouse,,Software Engineering,Entry Level
"Software Engineer 3, Cloud InTel",mongodb,New York City,https://www.mongodb.com/careers/job/?gh_jid=7248201,2025-10-13T17:07:31-04:00,greenhouse,,Software Engineering,Entry Level
"Software Engineer 3, Search Systems Replication & Routing",mongodb,San Francisco,https://www.mongodb.com/careers/job/?gh_jid=7235322,2025-10-13T17:07:31-04:00,greenhouse,,Software Engineering,Entry Level
"Staff Engineer, Cluster to Cluster",mongodb,United States,https://www.mongodb.com/careers/job/?gh_jid=7243944,2025-10-13T17:07:31-04:00,greenhouse,,Software Engineering,Entry Level
"Staff Site Reliability Engineer, Fabric",mongodb,Austin; Boston; Los Angeles; New York City; Raleigh; San Francisco; United States,https://www.mongodb.com/careers/job/?gh_jid=6987333,2025-10-13T17:07:31-04:00,greenhouse,,Software Engineering,Entry Level
"Staff Site Reliability Engineer, Infrastructure Security",mongodb,Austin; New York City; San Francisco; Seattle; United States,https://www.mongodb.com/careers/job/?gh_jid=6601882,2025-10-13T17:07:31-04:00,greenhouse,,Cybersecurity,Entry Level
"Staff Software Engineer, Atlas Growth",mongodb,New York City,https://www.mongodb.com/careers/job/?gh_jid=6658398,2025-10-13T17:07:31-04:00,greenhouse,,Software Engineering,Entry Level
"Staff Software Engineer, Networking & Observability",mongodb,Seattle; United States,https://www.mongodb.com/careers/job/?gh_jid=7264736,2025-10-13T17:07:31-04:00,greenhouse,,Software Engineering,Entry Level
"Staff Software Engineer, Query",mongodb,United States,https://www.mongodb.com/careers/job/?gh_jid=7221902,2025-10-13T17:07:31-04:00,greenhouse,,Software Engineering,Entry Level
"Staff Software Engineer, Server Security",mongodb,United States,https://www.mongodb.com/careers/job/?gh_jid=6515209,2025-10-13T17:07:31-04:00,greenhouse,,Cybersecurity,Entry Level
"Staff Software Engineer, Server Security",mongodb,New York City,https://www.mongodb.com/careers/job/?gh_jid=6352682,2025-10-13T17:07:31-04:00,greenhouse,,Cybersecurity,Entry Level
Workplace Specialist,mongodb,New York City,https://www.mongodb.com/careers/job/?gh_jid=7180554,2025-10-13T17:07:31-04:00,greenhouse,,Software Engineering,Entry Level
"Financial Analyst, FP&A",asana,San Francisco,https://www.asana.com/jobs/apply/7091844?gh_jid=7091844,2025-08-26T09:23:44-04:00,greenhouse,,Software Engineering,Entry Level
"Head of Engineering, Sharing & Permissions",asana,San Francisco,https://www.asana.com/jobs/apply/7190060?gh_jid=7190060,2025-09-03T20:23:41-04:00,greenhouse,,Software Engineering,Entry Level
Payroll Analyst,asana,San Francisco,https://www.asana.com/jobs/apply/7203537?gh_jid=7203537,2025-09-16T13:25:31-04:00,greenhouse,,Software Engineering,Entry Level
"Senior Software Engineer, Product",asana,San Francisco,https://www.asana.com/jobs/apply/6791159?gh_jid=6791159,2025-08-12T13:05:17-04:00,greenhouse,,Software Engineering,Entry Level
"Senior Software Engineer, Product",asana,New York City,https://www.asana.com/jobs/apply/6751576?gh_jid=6751576,2025-08-12T13:05:17-04:00,greenhouse,,Software Engineering,Entry Level
"Software Engineer, AI Integrations",asana,San Francisco,https://www.asana.com/jobs/apply/6708757?gh_jid=6708757,2025-08-25T09:33:03-04:00,greenhouse,,Software Engineering,Entry Level
"Software Engineer, CI/CD",asana,San Francisco,https://www.asana.com/jobs/apply/7299272?gh_jid=7299272,2025-10-10T13:49:50-04:00,greenhouse,,Software Engineering,Entry Level
"Software Engineer, Product",asana,San Francisco,https://www.asana.com/jobs/apply/7106554?gh_jid=7106554,2025-08-12T13:05:17-04:00,greenhouse,,Software Engineering,Entry Level
"Software Engineer, Product",asana,New York City,https://www.asana.com/jobs/apply/6751685?gh_jid=6751685,2025-10-02T11:09:30-04:00,greenhouse,,Software Engineering,Entry Level
"Staff Software Engineer, LunaServer",asana,San Francisco,https://www.asana.com/jobs/apply/7066858?gh_jid=7066858,2025-08-12T13:05:17-04:00,greenhouse,,Software Engineering,Entry Level
"Client Platform Engineer, Windows and VDI (Federal)",okta,"New York, New York",https://www.okta.com/company/careers/opportunity/7181561?gh_jid=7181561,2025-09-24T15:55:36-04:00,greenhouse,,Software Engineering,Entry Level
"Director, Developer Relations ",okta,"New York, New York",https://www.okta.com/company/careers/opportunity/7087699?gh_jid=7087699,2025-10-15T09:51:36-04:00,greenhouse,,Software Engineering,Entry Level
"Director, Engineering (Auth0)",okta,"San Francisco, California",https://www.okta.com/company/careers/opportunity/7139331?gh_jid=7139331,2025-10-15T09:52:19-04:00,greenhouse,,Software Engineering,Entry Level
"Director, Site Reliability Engineering -  Infrastructure Platform",okta,"San Francisco, California",https://www.okta.com/company/careers/opportunity/7317857?gh_jid=7317857,2025-10-13T17:58:18-04:00,greenhouse,,Software Engineering,Entry Level
Distinguished Engineer ,okta,"New York, New York",https://www.okta.com/company/careers/opportunity/6925175?gh_jid=6925175,2025-10-15T09:55:44-04:00,greenhouse,,Software Engineering,Entry Level
